{
  "$schema": "https://json-schema.org/draft/2020-12/schema",
  "$id": "https://adgendoc.local/prompts/extraction/attestation_concordance.schema.json",
  "title": "ExtractionResult ATTESTATION_CONCORDANCE",
  "description": "Sortie structurée de l'extraction IA pour ATTESTATION_CONCORDANCE. Ne jamais inventer : toute information administrative manquante (nom, date, lieu, référence...) doit rester absente de data et être déclarée dans missingFields. Aucune clé hors schéma.",
  "type": "object",
  "additionalProperties": false,
  "required": ["documentType", "confidence", "data", "missingFields"],
  "properties": {
    "documentType": {
      "const": "ATTESTATION_CONCORDANCE",
      "description": "Type de document supporté en itération 1."
    },
    "confidence": {
      "type": "number",
      "minimum": 0,
      "maximum": 1,
      "description": "Confiance estimée de l'extraction (métadonnée d'audit, jamais source de vérité)."
    },
    "data": {
      "type": "object",
      "additionalProperties": false,
      "description": "Champs uniquement s'ils sont présents dans la demande. Ne jamais inventer. Une clé obligatoire absente doit figurer dans missingFields.",
      "properties": {
        "prenom": { "type": "string", "minLength": 1, "maxLength": 100 },
        "nom": { "type": "string", "minLength": 1, "maxLength": 100 },
        "dateNaissance": {
          "type": "string",
          "pattern": "^\\d{4}-\\d{2}-\\d{2}$",
          "description": "Date ISO. 12/05/1985 devient 1985-05-12. Si absente ou ambiguë : la déclarer dans missingFields, ne jamais deviner."
        },
        "lieuNaissance": { "type": "string", "minLength": 1, "maxLength": 200 },
        "nomIncorrect": { "type": "string", "minLength": 1, "maxLength": 200 },
        "nomCorrect": { "type": "string", "minLength": 1, "maxLength": 200 },
        "sexe": { "type": "string", "enum": ["M", "F"] },
        "nationalite": { "type": "string", "minLength": 1, "maxLength": 100 },
        "documentSourceReference": { "type": "string", "minLength": 1, "maxLength": 100 },
        "langueDocument": { "type": "string", "enum": ["FR", "PT", "EN"] },
        "demandeur": { "type": "string", "minLength": 1, "maxLength": 200 },
        "contactEmail": { "type": "string", "minLength": 1, "maxLength": 254 },
        "contactTelephone": { "type": "string", "minLength": 6, "maxLength": 20 },
        "motif": { "type": "string", "minLength": 1, "maxLength": 500 }
      }
    },
    "missingFields": {
      "type": "array",
      "items": {
        "type": "string",
        "enum": ["prenom", "nom", "dateNaissance", "lieuNaissance", "nomIncorrect", "nomCorrect"]
      },
      "uniqueItems": true,
      "description": "Sous-ensemble des champs obligatoires réellement absents de data, dans l'ordre canonique. Jamais de valeur inventée pour les combler."
    }
  },
  "allOf": [
    { "if": { "not": { "required": ["prenom"] } },
      "then": { "missingFields": { "contains": { "const": "prenom" } } } },
    { "if": { "not": { "required": ["nom"] } },
      "then": { "missingFields": { "contains": { "const": "nom" } } } },
    { "if": { "not": { "required": ["dateNaissance"] } },
      "then": { "missingFields": { "contains": { "const": "dateNaissance" } } } },
    { "if": { "not": { "required": ["lieuNaissance"] } },
      "then": { "missingFields": { "contains": { "const": "lieuNaissance" } } } },
    { "if": { "not": { "required": ["nomIncorrect"] } },
      "then": { "missingFields": { "contains": { "const": "nomIncorrect" } } } },
    { "if": { "not": { "required": ["nomCorrect"] } },
      "then": { "missingFields": { "contains": { "const": "nomCorrect" } } } }
  ]
}
