{
  "documentType": "ATTESTATION_CONCORDANCE",
  "confidence": 0.97,
  "data": {
    "prenom": "Maria",
    "nom": "Gomes",
    "dateNaissance": "1985-05-12",
    "lieuNaissance": "Bissau",
    "nomIncorrect": "Maria Gomez",
    "nomCorrect": "Maria Gomes",
    "motif": "Dossier bancaire"
  },
  "missingFields": []
}
